{
  "schema": "loadout/v1",
  "item_type": "rule",
  "name": "my-rule",
  "version": "1.0.0",
  "description": "Example rule manifest using the loadout common base.",
  "source": "https://example.com/my-rule",
  "homepage": "https://example.com/my-rule",
  "author": { "name": "Example Author", "url": "https://example.com" },
  "license": "MIT",
  "supports": ["claude", "cursor", "gemini"],
  "usage": "Read my-rule on demand when working in the relevant area."
}
